"Yeah, yeah, all of them have it.",
This is wonderful.,
Look at that.,
We're discovering stuff.,
"Okay, that's, that's really useful.",
Okay.,
I need to an example.,
"No, but it tells you exactly what you need to.",
"So, okay, so if we go for the measured variable one,",
"single-asker will be the perceived taste and spruly. No, so we're measuring",
our confidence in the pre-registration process.,
"on a 1 to 5, oh sorry, wrong dash.",
"Like it, that I can type the N-Dash on a Mac keyboard,",
so something about me that is deeply uncomfortable.,
"5 scale, where 1 is I have no confidence.",
Yes.,
"Yeah, I will in a sec.",
And,
5 is,
I am overconfident?,
"No, um, utterly confident.",
Put some quotes in.,
"Well, I mean, ideally I'd be using Emacs, right?",
"Does ControlE work on this? Oh, it does.",
"Hey, look, control A, controlling.",
"You need to open the brackets somewhere, the parentage.",
Just before the where.,
"You mean syntax, Sarah?",
"Okay, so are there any other measured things?",
We are measuring our process of completing this paperwork?,
Are we really measured?,
We are measuring the process.,
I don't know what measure we're using.,
"Yes, it will be the analysis, what do you mean?",
And the...,
Yes.,
"This is the point, right? This is pre-registering the analysis only.",
So we will be measuring some form of the process itself.,
We are measuring the process of collecting the data of filling in.,
Proofing description.,
"And plan as textual transcription transcripts, we do not know.",
"Oh, oh, God.",
"Oh, that works.",
Command Z.,
"Oh, no.",
"Okay, so some of the Emacs commands work.",
Some of them don't.,
"Yeah, I wouldn't expect that what web browser is this one?",
"It's Edge, which is, of course, the one that we are required to use as part of the",
University of Bristol.,
Not in my Linux machine?,
"In your Linux machine, absolutely.",
"Linnit Edge is the only supported browser by the University of Bristol, I believe.",
I've installed it specially for the study.,
"Well, I'd say read is a strong word.",
I know I'm being recorded.,
Hello.,
"Hello, SLO.",
"I love you a lot, even though I think you're nuts sometimes.",
But that is of no surprise to him.,
I believe he says the record stands that I am a troll and I'm tolerated on the grounds that I sometimes do reasonable work.,
I'm filling in the registered as free textual transcripts and I guess there's also a...,
Which will be analyzed.,
And we don't know what the outcome measured looks like because...,
For themes.,
Once collected.,
Which will we analyse for themes once analysed?,
"Has to be that way round, even though it's horrific because it is.",
And so that last sentence turns into the success of the pre-registration itself.,
We are measuring the success or not of being able to pre-register as the son as a...,
as a Boolean.,
"No, come on, we're computer scientists. Let's make one.",
It's specified before.,
"This is a bullion. It's true or false, right?",
"Yeah, yeah, yeah. Yeah, yeah, right.",
Let's offer some measures to the electrical engineers in the building with a voltage under.,
0.3 volts signifying...,
"No, hang on, I'm being trolley.",
"Yeah, yeah, it's not the other one, yeah, right.",
"So, or an average voltage of above 0.7, and anything in between will be...",
"...and define, and...",
...unsteady.,
"Hope that you've got error connection, ma'am.",
Oh.,
Why are we doing this?,
"Let's proceed. We are already... We are... No, we need to go back to the design.",
"Yeah, yeah, yeah, that's the almost.",
"In 14 minutes, I think we can do it today.",
"Hang on, let's have a quick look at the metadata. Oh, no.",
So design plan is the sort of thing we need to do.,
"Show example. We like the show example, but...",
"Oh, it's much shorter than I thought they were hoping.",
"they were hoping. Okay, so then we can answer this easy. It's the great sentence that Evese keeps saying to us",
that we don't really understand. Autofnographic observational study of the pre-registration process.,
I wouldn't believe this example fulfills the... What is asking?,
"No, but it's asking, it's asking it. It would really have.",
"high level, what is the method that you're applying?",
"Well, to be as detailed as is necessary given the specific priority design, well, I mean, it looks complex.",
"No, it's between subjects, right?",
"So you've got two groups, with one factor.",
One factor will be given large sugar by maths and four levels.,
One group is going to be given none.,
"One group is going to be given one gram, one group's going to be given 10 grand, one group is going",
"to give them 100 grams, and they're going to do a direct comparison between the groups.",
It tells you absolutely everything you need to know.,
Yeah.,
Except explain how the groups are going to be selected.,
"Yeah, for example.",
Randomized logs.,
"Well, it'll be the ones you get the one ground, ten ground.",
"Yeah, but it's specified randomized logs, repeated measures.",
Of the study designers attempting to pre-register the study and design.,
open science guidelines. Did we mention open science guidelines in any part of this?,
"Yeah, we did in the study information.",
But you can I forgot already what we are doing. That's that was two in the study information.,
"Yeah, we're doing an author of an order of attempt to do open science, let's do an auto-ethnographic study trying to do open science.",
And designing guidelines. In order to attempt to do to write guidelines for open science. I think that was the...,
"No, no, in the first part, in order to attempt to write guidelines to do open science.",
Oh!,
Right.,
"Guidelines to do open science, let's do an author.",
"Yeah, okay.",
I think it's worth saying to evase as the only person.,
"a vase is the only person who has a vague idea of what we actually are meant to be of doing,",
"that he really needs to turn up next week, or in two weeks time, that's bit he's not going to turn up.",
And what is the missing step here for the registration? Should we just inform our ways?,
"Right. It's right. And no, no, because I want to talk to a thing later.",
Should we ask a ways if he wants to take a look before we submit the presentation?,
"No, because I want him, because we should be recording him having a look at it",
and his comments that come back because that's part of the study.,
So he should be in here being recorded.,
It's not enough if he'd ask him to recall himself reacting to the...,
to the...,
"Yeah, and that's fine for me.",
I would just...,
You know what?,
Evace was the one who insisted that we do it like this.,
I kind of don't care that it's pets.,
"If he has to wait another week, I'd rather we did it like that",
"than we did it in person, but he's the one who wanted us to do it like this.",
Yeah.,
He should be here to do it.,
Yeah.,
"Otherwise, what's the point?",
Yeah.,
I'm learning.,
"Yeah, we're all learning.",
we could have done it a lot more cheaply by actually having,
"something worse, sorry?",
"Well, no, but I think, and like in fairness to it all,",
"I think actually the process, I think it is actually interesting",
"looking at how people do it and where they struggle, right?",
"And it will be, and it will make an interesting paper.",
"I think even just the fact that we now noticed to show example,",
It's so insane.,
"On a giant, what, enormous monitor of death,",
it took us two weeks to notice the show.,
"And even then, when we look at it, we got picky about it.",
It wasn't really helpful.,
"Well, that was kind of funny, right?",
"You aren't familiar with this, and you were like,",
"oh, this is completely unhelpful.",
"But I kind of went, no, this is helpful",
because that tells me exactly what you're expecting,
"in terms of it's a one-line answer,",
"is very succinct, what is the method?",
I think I'm happy to call it a day here before I turn inward on myself and die.,
"Yeah, and we tell a ways that he's expected in two weeks.",
Yeah.,
Do you want me to do that?,
"No, I am benevolent dictator.",
I will go shout at the prof.,
He's well used to me shouting at him.,
"I am grumpy and he can bat off me and if he does I will go and tell Roosa, who is the person who is doing this, that one of our members isn't taking part and isn't being a productive member of society.",
Which I believe is the correct process of following for doing this and is a reasonable way of doing it.,
I'm going to cut recording now.,